Query,Page,Clicks,Impressions,CTR,Position
schenectady county ny epa radon zone,https://radonverdict.com/radon-levels/new-york/schenectady-county,0,49,0,3.326
schenectady county ny radon zone epa new york,https://radonverdict.com/radon-levels/new-york/schenectady-county,0,20,0,3.05
schenectady county ny radon zone epa,https://radonverdict.com/radon-levels/new-york/schenectady-county,0,21,0,3.429
epa radon zone fremont county idaho,https://radonverdict.com/radon-levels/idaho/fremont-county,0,14,0,2.643
radon gas testing ulster county ny,https://radonverdict.com/radon-levels/new-york/ulster-county,0,127,0,51.811
radon testing in lebanon pa,https://radonverdict.com/radon-mitigation-cost/pennsylvania/lebanon-county,0,35,0,37
radon testing hood river or,https://radonverdict.com/radon-mitigation-cost/oregon/hood-river-county,0,20,0,33.6
radon testing jefferson or,https://radonverdict.com/radon-mitigation-cost/oregon/jefferson-county,0,9,0,12.22
radon testing shoshone id,https://radonverdict.com/radon-mitigation-cost/idaho/shoshone-county,0,9,0,22.33
radon gas mitigation winona,https://radonverdict.com/radon-mitigation-cost/minnesota/winona-county,0,12,0,14.75
radon gas mitigation waseca,https://radonverdict.com/radon-mitigation-cost/minnesota/waseca-county,0,7,0,10.57
transylvania radon mitigation,https://radonverdict.com/radon-mitigation-cost/north-carolina/transylvania-county,0,9,0,18.67
n. hampton county radon mitigation,https://radonverdict.com/radon-mitigation-cost/pennsylvania/northampton-county,0,4,0,11
monroe county radon mitigation,https://radonverdict.com/radon-mitigation-cost/pennsylvania/monroe-county,0,5,0,5.2
oconee radon mitigation,https://radonverdict.com/radon-mitigation-cost/south-carolina/oconee-county,0,3,0,6.667
kewaunee radon mitigation,https://radonverdict.com/radon-mitigation-cost/wisconsin/kewaunee-county,0,3,0,9.67
tyler radon mitigation,https://radonverdict.com/radon-mitigation-cost/texas/tyler-county,0,5,0,11.8
sub slab radon mitigation system cost illinois,https://radonverdict.com/radon-mitigation-cost/illinois/rock-island-county,0,1,0,12
how much to have sub slab radon mitigation system illinois,https://radonverdict.com/radon-mitigation-cost/illinois/clark-county,0,1,0,16
radon testing summit station oh,https://radonverdict.com/radon-levels/ohio/summit-county,0,3,0,14.33
radon testing wabash in,https://radonverdict.com/radon-levels/indiana/wabash-county,0,4,0,10.25
radon testing washington ut,https://radonverdict.com/radon-levels/utah/washington-county,0,4,0,27.25
radon mitigation boulder co,https://radonverdict.com/radon-levels/colorado/boulder-county,0,3,0,84.33
radon testing boulder co,https://radonverdict.com/radon-levels/colorado/boulder-county,0,2,0,64
radon testing for investors in connecticut,https://radonverdict.com/radon-mitigation-cost/connecticut/connecticut,0,1,0,36
radon mitigation near me,https://radonverdict.com/radon-mitigation-cost/indiana/gibson-county,1,1,1,2
radon levels in basement falls church va,https://radonverdict.com/radon-levels/virginia/falls-church-city,0,88,0,9.727
electronic radon testing anoka,https://radonverdict.com/radon-levels/minnesota/anoka-county,0,4,0,14.75
